{
 "meta": {
  "organization": "Northwind Precision（虛構）",
  "analysis_date": "2026-09-08",
  "generated_by": "demo-engine (assets/demo.js) / skill 1.0.0",
  "scope_reference": "SYN-AUTH-2026-09",
  "scoring_rules": "本專案示範規則（task-spec 附錄 A）；風險胃納 balanced，門檻 P1 ≥ 60、P2 ≥ 40、P3 ≥ 20；權重 {\"exposure\":1,\"exploit\":1,\"identity\":0.8,\"control\":0.8,\"intel\":1,\"impact\":1}",
  "disclaimer": "本輸出由確定性示範引擎依合成資料產生；語言模型或引擎皆未驗證實際曝險；所有攻擊路徑為假設；任何主動測試與正式環境變更需人工書面授權。"
 },
 "data_quality": {
  "confidence": "中",
  "basis": "各檔案筆數與可用性",
  "missing_inputs": [
   "威脅情資"
  ],
  "requires_human": true,
  "files": [
   {
    "missing_fields": [],
    "anomalies": [
     "主動測試授權 = false；外部掃描授權 = false"
    ],
    "name": "scope.json",
    "records": 1
   },
   {
    "missing_fields": [],
    "anomalies": [],
    "name": "assets.csv",
    "records": 12
   },
   {
    "missing_fields": [],
    "anomalies": [],
    "name": "vulnerabilities.csv",
    "records": 14
   },
   {
    "missing_fields": [],
    "anomalies": [
     "old-test.northwind-synthetic.example（asset_id null）未納入清冊"
    ],
    "name": "exposures.json",
    "records": 7
   },
   {
    "missing_fields": [],
    "anomalies": [],
    "name": "identities.csv",
    "records": 8
   },
   {
    "missing_fields": [],
    "anomalies": [],
    "name": "misconfigurations.csv",
    "records": 9
   },
   {
    "missing_fields": [],
    "anomalies": [],
    "name": "controls.json",
    "records": 8
   },
   {
    "missing_fields": [],
    "anomalies": [],
    "name": "topology.json",
    "records": 19
   }
  ],
  "out_of_scope_excluded": [],
  "inventory_completeness_estimate": 100
 },
 "exposure_priorities": {
  "confidence": "中",
  "basis": "可能性 × 影響（附錄 A 示範規則）",
  "missing_inputs": [
   "威脅情資"
  ],
  "requires_human": true,
  "items": [
   {
    "finding_id": "F001",
    "asset_id": "A01",
    "asset_name": "vpn-gw-01",
    "vuln_id": "SYN-2026-0101",
    "title": "VPN appliance pre-auth RCE (synthetic)",
    "priority": "P1",
    "score": 86,
    "likelihood": 10,
    "impact": 8.6,
    "factors": [
     "對外曝露",
     "EASM 議題：outdated-firmware、legacy-tls",
     "公開利用程式",
     "模擬 EPSS 0.91",
     "模擬 KEV（已知遭利用）",
     "身分弱點 ×1",
     "設定偏差 ×1",
     "既有控制：Central logging / SIEM",
     "控制缺口：EDR、MFA、Patch SLA",
     "可達 crown jewel 之入口（blast radius）"
    ],
    "missing": [
     "威脅情資"
    ],
    "confidence": "中"
   },
   {
    "finding_id": "F003",
    "asset_id": "A02",
    "asset_name": "web-portal-01",
    "vuln_id": "SYN-2026-0210",
    "title": "SynthCMS file upload leads to RCE (synthetic)",
    "priority": "P1",
    "score": 68.7,
    "likelihood": 7.2,
    "impact": 9.6,
    "factors": [
     "對外曝露",
     "EASM 議題：outdated-cms、http-redirect-missing",
     "公開利用程式",
     "模擬 EPSS 0.62",
     "身分弱點 ×1",
     "設定偏差 ×1",
     "既有控制：EDR、WAF、Central logging / SIEM、Patch SLA",
     "可達 crown jewel 之入口（blast radius）"
    ],
    "missing": [
     "威脅情資"
    ],
    "confidence": "中"
   },
   {
    "finding_id": "F012",
    "asset_id": "A10",
    "asset_name": "s3-backup-bucket",
    "vuln_id": "SYN-2026-0402",
    "title": "Object storage bucket policy allows anonymous list (synthetic)",
    "priority": "P1",
    "score": 64.4,
    "likelihood": 6.4,
    "impact": 10,
    "factors": [
     "對外曝露",
     "EASM 議題：anonymous-list",
     "身分弱點 ×1",
     "設定偏差 ×1",
     "控制缺口：Immutable backups、Central logging / SIEM",
     "可達 crown jewel 之入口（blast radius）"
    ],
    "missing": [
     "威脅情資"
    ],
    "confidence": "中"
   },
   {
    "finding_id": "F009",
    "asset_id": "A07",
    "asset_name": "mes-srv-01",
    "vuln_id": "SYN-2023-0044",
    "title": "SynthMES unauthenticated API (synthetic)",
    "priority": "P1",
    "score": 62.5,
    "likelihood": 6.3,
    "impact": 10,
    "factors": [
     "公開利用程式",
     "模擬 EPSS 0.55",
     "身分弱點 ×1",
     "設定偏差 ×1",
     "控制缺口：EDR、Network segmentation、MFA、Central logging / SIEM、Patch SLA",
     "crown jewel"
    ],
    "missing": [
     "威脅情資"
    ],
    "confidence": "中"
   },
   {
    "finding_id": "F005",
    "asset_id": "A03",
    "asset_name": "mail-gw-01",
    "vuln_id": "SYN-2026-0150",
    "title": "Mail gateway auth bypass (synthetic)",
    "priority": "P2",
    "score": 56.2,
    "likelihood": 7.8,
    "impact": 7.2,
    "factors": [
     "對外曝露",
     "EASM 議題：auth-bypass-advisory",
     "公開利用程式",
     "控制缺口：EDR、Central logging / SIEM、Patch SLA",
     "可達 crown jewel 之入口（blast radius）"
    ],
    "missing": [
     "威脅情資"
    ],
    "confidence": "中"
   },
   {
    "finding_id": "F008",
    "asset_id": "A06",
    "asset_name": "erp-db-01",
    "vuln_id": "SYN-2024-0810",
    "title": "PostgreSQL privilege escalation (synthetic)",
    "priority": "P2",
    "score": 52.8,
    "likelihood": 5.3,
    "impact": 10,
    "factors": [
     "公開利用程式",
     "身分弱點 ×2",
     "設定偏差 ×1",
     "既有控制：Network segmentation",
     "控制缺口：EDR、Central logging / SIEM、Deception (honey accounts/tokens)",
     "crown jewel"
    ],
    "missing": [
     "威脅情資"
    ],
    "confidence": "中"
   },
   {
    "finding_id": "F002",
    "asset_id": "A01",
    "asset_name": "vpn-gw-01",
    "vuln_id": "SYN-2025-0342",
    "title": "VPN admin panel weak session handling (synthetic)",
    "priority": "P2",
    "score": 48.3,
    "likelihood": 5.6,
    "impact": 8.6,
    "factors": [
     "對外曝露",
     "EASM 議題：outdated-firmware、legacy-tls",
     "身分弱點 ×1",
     "設定偏差 ×1",
     "既有控制：Central logging / SIEM",
     "控制缺口：EDR、MFA、Patch SLA",
     "可達 crown jewel 之入口（blast radius）"
    ],
    "missing": [
     "威脅情資"
    ],
    "confidence": "中"
   },
   {
    "finding_id": "F006",
    "asset_id": "A04",
    "asset_name": "ad-dc-01",
    "vuln_id": "SYN-2025-0500",
    "title": "Kerberos ticket handling weakness (synthetic)",
    "priority": "P3",
    "score": 39.8,
    "likelihood": 4,
    "impact": 10,
    "factors": [
     "公開利用程式",
     "身分弱點 ×2",
     "設定偏差 ×1",
     "既有控制：EDR、Central logging / SIEM、Patch SLA",
     "控制缺口：Deception (honey accounts/tokens)"
    ],
    "missing": [
     "威脅情資"
    ],
    "confidence": "中"
   },
   {
    "finding_id": "F013",
    "asset_id": "A11",
    "asset_name": "ci-runner-01",
    "vuln_id": "SYN-2026-0388",
    "title": "CI runner exposes token in build logs (synthetic)",
    "priority": "P3",
    "score": 36.1,
    "likelihood": 5,
    "impact": 7.2,
    "factors": [
     "對外曝露",
     "身分弱點 ×1",
     "設定偏差 ×1",
     "既有控制：Patch SLA",
     "控制缺口：EDR、Central logging / SIEM",
     "可達 crown jewel 之入口（blast radius）"
    ],
    "missing": [
     "威脅情資"
    ],
    "confidence": "中"
   },
   {
    "finding_id": "F004",
    "asset_id": "A02",
    "asset_name": "web-portal-01",
    "vuln_id": "SYN-2025-0977",
    "title": "Nginx outdated version (synthetic)",
    "priority": "P3",
    "score": 32.5,
    "likelihood": 3.4,
    "impact": 9.6,
    "factors": [
     "對外曝露",
     "EASM 議題：outdated-cms、http-redirect-missing",
     "身分弱點 ×1",
     "設定偏差 ×1",
     "既有控制：EDR、WAF、Central logging / SIEM、Patch SLA",
     "可達 crown jewel 之入口（blast radius）"
    ],
    "missing": [
     "威脅情資"
    ],
    "confidence": "中"
   },
   {
    "finding_id": "F014",
    "asset_id": "A12",
    "asset_name": "hr-saas-sso",
    "vuln_id": "SYN-2026-0290",
    "title": "SSO app lacks MFA enforcement for admins (synthetic)",
    "priority": "P3",
    "score": 28.5,
    "likelihood": 4.6,
    "impact": 6.2,
    "factors": [
     "對外曝露",
     "EASM 議題：admin-mfa-not-enforced",
     "身分弱點 ×1",
     "設定偏差 ×1",
     "既有控制：MFA"
    ],
    "missing": [
     "威脅情資"
    ],
    "confidence": "中"
   },
   {
    "finding_id": "F010",
    "asset_id": "A08",
    "asset_name": "file-srv-01",
    "vuln_id": "SYN-2025-0620",
    "title": "SMB signing not enforced (synthetic)",
    "priority": "P4",
    "score": 15.3,
    "likelihood": 2.5,
    "impact": 6.2,
    "factors": [
     "公開利用程式",
     "身分弱點 ×1",
     "既有控制：EDR、Patch SLA",
     "控制缺口：Deception (honey accounts/tokens)"
    ],
    "missing": [
     "威脅情資"
    ],
    "confidence": "中"
   },
   {
    "finding_id": "F007",
    "asset_id": "A05",
    "asset_name": "erp-app-01",
    "vuln_id": "SYN-2026-0333",
    "title": "SynthERP deserialization RCE (synthetic)",
    "priority": "P4",
    "score": 0,
    "likelihood": 0,
    "impact": 10,
    "factors": [
     "身分弱點 ×1",
     "既有控制：EDR、Central logging / SIEM、Patch SLA"
    ],
    "missing": [
     "威脅情資"
    ],
    "confidence": "中"
   },
   {
    "finding_id": "F011",
    "asset_id": "A09",
    "asset_name": "jump-host-01",
    "vuln_id": "SYN-2026-0015",
    "title": "RDP exposed to user VLAN without MFA (synthetic)",
    "priority": "P4",
    "score": 0,
    "likelihood": 0,
    "impact": 6.6,
    "factors": [
     "既有控制：EDR、MFA、Central logging / SIEM、Patch SLA"
    ],
    "missing": [
     "威脅情資"
    ],
    "confidence": "中"
   }
  ],
  "thresholds": {
   "P1": 60,
   "P2": 40,
   "P3": 20
  }
 },
 "attack_path_hypotheses": {
  "confidence": "中",
  "basis": "拓樸邊 + 節點可能性的 DFS 推論（最長 5 跳）",
  "missing_inputs": [
   "威脅情資"
  ],
  "requires_human": true,
  "items": [
   {
    "id": "H1",
    "entry": "vpn-gw-01",
    "target": "erp-db-01",
    "entry_id": "A01",
    "target_id": "A06",
    "nodes": [
     "internet",
     "vpn-gw-01",
     "ad-dc-01",
     "erp-db-01"
    ],
    "node_ids": [
     "A01",
     "A04",
     "A06"
    ],
    "edges": [
     "internet → vpn-gw-01（VPN 443/tcp；exposed）",
     "vpn-gw-01 → ad-dc-01（VPN 使用者網段可達 DC (LDAP/Kerberos/SMB)；network）",
     "ad-dc-01 → erp-db-01（svc-erp-sync 憑證；identity）"
    ],
    "feasibility": 6,
    "blocking_controls": [
     "Central logging / SIEM",
     "EDR",
     "Patch SLA",
     "Network segmentation"
    ],
    "status": "hypothesis"
   },
   {
    "id": "H2",
    "entry": "vpn-gw-01",
    "target": "erp-db-01",
    "entry_id": "A01",
    "target_id": "A06",
    "nodes": [
     "internet",
     "vpn-gw-01",
     "ad-dc-01",
     "erp-app-01",
     "erp-db-01"
    ],
    "node_ids": [
     "A01",
     "A04",